{
  "$schema": "https://json-schema.org/draft/2020-12/schema",
  "$id": "https://spine-packs.local/contracts/schemas/spine-pack-manifest.v1.schema.json",
  "title": "Spine Pack Manifest v1",
  "type": "object",
  "required": [
    "manifest_schema",
    "pack",
    "compatibility",
    "dependencies",
    "archetypes",
    "notification_profiles",
    "binding_intents",
    "content_identity"
  ],
  "properties": {
    "manifest_schema": { "const": "spine.pack-manifest.v1" },
    "pack": { "$ref": "#/$defs/pack" },
    "compatibility": { "$ref": "#/$defs/compatibility" },
    "dependencies": {
      "type": "array",
      "maxItems": 0
    },
    "archetypes": {
      "type": "array",
      "minItems": 1,
      "maxItems": 256,
      "items": { "$ref": "#/$defs/archetype" }
    },
    "notification_profiles": {
      "type": "array",
      "minItems": 1,
      "maxItems": 256,
      "items": { "$ref": "#/$defs/notificationProfile" }
    },
    "binding_intents": {
      "type": "array",
      "minItems": 1,
      "maxItems": 256,
      "items": { "$ref": "#/$defs/bindingIntent" }
    },
    "content_identity": { "$ref": "#/$defs/contentIdentity" }
  },
  "additionalProperties": false,
  "$defs": {
    "key": {
      "type": "string",
      "pattern": "^[a-z][a-z0-9_-]{0,63}$"
    },
    "packId": {
      "type": "string",
      "maxLength": 64,
      "pattern": "^[a-z][a-z0-9]*(?:-[a-z0-9]+)*$"
    },
    "stableVersion": {
      "type": "string",
      "pattern": "^(0|[1-9][0-9]*)\\.(0|[1-9][0-9]*)\\.(0|[1-9][0-9]*)$"
    },
    "draftVersion": {
      "type": "string",
      "pattern": "^(0|[1-9][0-9]*)\\.(0|[1-9][0-9]*)\\.(0|[1-9][0-9]*)-draft\\.[1-9][0-9]*$"
    },
    "pack": {
      "oneOf": [
        {
          "type": "object",
          "required": ["pack_id", "version", "status"],
          "properties": {
            "pack_id": { "$ref": "#/$defs/packId" },
            "version": { "$ref": "#/$defs/draftVersion" },
            "status": { "const": "draft" }
          },
          "additionalProperties": false
        },
        {
          "type": "object",
          "required": ["pack_id", "version", "status"],
          "properties": {
            "pack_id": { "$ref": "#/$defs/packId" },
            "version": { "$ref": "#/$defs/stableVersion" },
            "status": { "const": "released" }
          },
          "additionalProperties": false
        }
      ]
    },
    "compatibility": {
      "type": "object",
      "required": ["spine_runtime_versions", "spine_content_contracts"],
      "properties": {
        "spine_runtime_versions": {
          "type": "array",
          "minItems": 1,
          "uniqueItems": true,
          "items": { "$ref": "#/$defs/stableVersion" }
        },
        "spine_content_contracts": {
          "type": "array",
          "minItems": 3,
          "maxItems": 3,
          "uniqueItems": true,
          "items": {
            "enum": [
              "spine.item-archetypes.v1",
              "spine.notification-profile-bindings.v1",
              "spine.notification-profiles.v1"
            ]
          }
        }
      },
      "additionalProperties": false
    },
    "itemTypes": {
      "type": "array",
      "minItems": 1,
      "maxItems": 2,
      "uniqueItems": true,
      "items": { "enum": ["event", "task"] }
    },
    "description": {
      "oneOf": [
        { "type": "string", "minLength": 1, "maxLength": 2000 },
        { "type": "null" }
      ]
    },
    "archetypeRevision": {
      "type": "object",
      "required": ["display_name", "description", "compatible_item_types"],
      "properties": {
        "display_name": { "type": "string", "minLength": 1, "maxLength": 160 },
        "description": { "$ref": "#/$defs/description" },
        "compatible_item_types": { "$ref": "#/$defs/itemTypes" }
      },
      "additionalProperties": false
    },
    "archetype": {
      "type": "object",
      "required": ["archetype_key", "intended_status", "revision"],
      "properties": {
        "archetype_key": { "$ref": "#/$defs/key" },
        "intended_status": { "const": "active" },
        "revision": { "$ref": "#/$defs/archetypeRevision" }
      },
      "additionalProperties": false
    },
    "elapsedBeforeSchedule": {
      "type": "object",
      "required": ["kind", "at"],
      "properties": {
        "kind": { "const": "once" },
        "at": {
          "type": "object",
          "required": ["kind", "offset_basis", "offset_seconds"],
          "properties": {
            "kind": { "const": "target_offset" },
            "offset_basis": { "const": "elapsed" },
            "offset_seconds": {
              "type": "string",
              "pattern": "^-[1-9][0-9]*$"
            }
          },
          "additionalProperties": false
        }
      },
      "additionalProperties": false
    },
    "lateHandling": {
      "type": "object",
      "required": ["kind", "grace_seconds"],
      "properties": {
        "kind": { "const": "deliver_within" },
        "grace_seconds": {
          "type": "string",
          "pattern": "^[1-9][0-9]*$"
        }
      },
      "additionalProperties": false
    },
    "template": {
      "type": "object",
      "required": ["template_key", "schedule", "late_handling"],
      "properties": {
        "template_key": { "$ref": "#/$defs/key" },
        "schedule": { "$ref": "#/$defs/elapsedBeforeSchedule" },
        "late_handling": { "$ref": "#/$defs/lateHandling" }
      },
      "additionalProperties": false
    },
    "profileRevision": {
      "type": "object",
      "required": ["compatible_item_types", "templates"],
      "properties": {
        "compatible_item_types": { "$ref": "#/$defs/itemTypes" },
        "templates": {
          "type": "array",
          "minItems": 1,
          "maxItems": 32,
          "items": { "$ref": "#/$defs/template" }
        }
      },
      "additionalProperties": false
    },
    "notificationProfile": {
      "type": "object",
      "required": [
        "profile_key",
        "display_name",
        "description",
        "intended_status",
        "revision"
      ],
      "properties": {
        "profile_key": { "$ref": "#/$defs/key" },
        "display_name": { "type": "string", "minLength": 1, "maxLength": 160 },
        "description": { "$ref": "#/$defs/description" },
        "intended_status": { "const": "active" },
        "revision": { "$ref": "#/$defs/profileRevision" }
      },
      "additionalProperties": false
    },
    "bindingIntent": {
      "type": "object",
      "required": ["binding_kind", "archetype_key", "notification_profile_key"],
      "properties": {
        "binding_kind": { "const": "archetype_default" },
        "archetype_key": { "$ref": "#/$defs/key" },
        "notification_profile_key": { "$ref": "#/$defs/key" }
      },
      "additionalProperties": false
    },
    "contentIdentity": {
      "type": "object",
      "required": ["algorithm", "canonical_json_version", "digest"],
      "properties": {
        "algorithm": { "const": "sha256" },
        "canonical_json_version": { "const": "spine.canonical-json.v1" },
        "digest": {
          "type": "string",
          "pattern": "^[0-9a-f]{64}$"
        }
      },
      "additionalProperties": false
    }
  }
}
